codigo,descripcion,categoria
Z13,Examen de detección especial de otras enfermedades y trastornos,Factores que influyen en el estado de salud
Z20,Contacto con y exposición a enfermedades transmisibles,Factores que influyen en el estado de salud
Z21,Estado de infección asintomática por el virus de la inmunodeficiencia humana,Factores que influyen en el estado de salud
Z22,Portador de enfermedades infecciosas,Factores que influyen en el estado de salud
Z23,Necesidad de inmunización contra enfermedades bacterianas únicas,Factores que influyen en el estado de salud
Z25,Necesidad de inmunización contra otras enfermedades virales únicas,Factores que influyen en el estado de salud
Z26,Necesidad de inmunización contra otras enfermedades infecciosas únicas,Factores que influyen en el estado de salud
Z29,Necesidad de otras medidas profilácticas,Factores que influyen en el estado de salud
Z30,Anticoncepción,Factores que influyen en el estado de salud
Z34,Supervisión de embarazo normal,Factores que influyen en el estado de salud
Z36,Examen de detección prenatal,Factores que influyen en el estado de salud
Z37,Resultado del parto,Factores que influyen en el estado de salud
Z38,Niños nacidos vivos según el lugar de nacimiento,Factores que influyen en el estado de salud
Z39,Examen y atención del postparto,Factores que influyen en el estado de salud
Z51,Atención médica de otro tipo,Factores que influyen en el estado de salud
Z71,Personas que se ponen en contacto con los servicios de salud para otros procedimientos de consulta,Factores que influyen en el estado de salud
Z72,Problemas relacionados con el estilo de vida,Factores que influyen en el estado de salud
Z73,Problemas relacionados con dificultades para afrontar la vida,Factores que influyen en el estado de salud
Z75,Problemas relacionados con instalaciones médicas y otro tipo de atención de salud,Factores que influyen en el estado de salud
Z76,Personas que se ponen en contacto con los servicios de salud en otras circunstancias,Factores que influyen en el estado de salud
Z80,Historia familiar de tumores malignos,Antecedentes familiares
Z82,Historia familiar de ciertas discapacidades y enfermedades crónicas,Antecedentes familiares
Z84,Historia familiar de otras afecciones,Antecedentes familiares
Z85,Historia personal de tumor maligno,Antecedentes personales
Z86,Historia personal de ciertas otras enfermedades,Antecedentes personales
Z87,Historia personal de otras enfermedades y afecciones,Antecedentes personales
Z88,Alergias a drogas medicamentos y sustancias biológicas en los antecedentes personales,Antecedentes personales
Z89,Miembro ausente adquirido,Antecedentes personales
Z91,Historia personal de factores de riesgo no clasificados en otra parte,Antecedentes personales
Z96,Presencia de otros implantes funcionales,Estado de salud
Z97,Presencia de otros dispositivos,Estado de salud
